{
  "$schema": "http://json-schema.org/draft-07/schema#",
  "type": "object",
  "title": "ProgressBarConfig",
  "description": "A progress bar or stepper with configurable modes, sizes, and animations",
  "required": [
    "title",
    "mode"
  ],
  "properties": {
    "title": {
      "type": "string"
    },
    "mode": {
      "type": "string",
      "enum": [
        "bar",
        "stepper"
      ]
    },
    "value": {
      "type": "number",
      "minimum": 0,
      "maximum": 100
    },
    "showPercentage": {
      "type": "boolean"
    },
    "animated": {
      "type": "boolean"
    },
    "striped": {
      "type": "boolean"
    },
    "size": {
      "type": "string",
      "enum": [
        "sm",
        "md",
        "lg"
      ]
    },
    "color": {
      "type": "string"
    },
    "steps": {
      "type": "array",
      "items": {
        "type": "object",
        "required": [
          "label"
        ],
        "properties": {
          "label": {
            "type": "string"
          },
          "description": {
            "type": "string"
          }
        }
      }
    },
    "currentStep": {
      "type": "number",
      "minimum": 0
    },
    "allowClickNavigation": {
      "type": "boolean"
    },
    "appearance": {
      "type": "object",
      "description": "Visual polish: entrance animation, dark mode colors, responsive breakpoints",
      "properties": {
        "animation": {
          "type": "object",
          "properties": {
            "entrance": {
              "type": "string",
              "enum": [
                "none",
                "fade",
                "slide",
                "scale"
              ],
              "default": "none"
            },
            "duration": {
              "type": "number",
              "default": 300
            },
            "delay": {
              "type": "number",
              "default": 0
            }
          }
        },
        "darkMode": {
          "type": "object",
          "properties": {
            "background": {
              "type": "string"
            },
            "surface": {
              "type": "string"
            },
            "text": {
              "type": "string"
            },
            "textSecondary": {
              "type": "string"
            },
            "accent": {
              "type": "string"
            },
            "border": {
              "type": "string"
            }
          }
        },
        "responsive": {
          "type": "object",
          "properties": {
            "padding": {
              "type": "object",
              "properties": {
                "mobile": {
                  "type": "string"
                },
                "tablet": {
                  "type": "string"
                },
                "desktop": {
                  "type": "string"
                }
              }
            },
            "maxWidth": {
              "type": "object",
              "properties": {
                "mobile": {
                  "type": "string"
                },
                "tablet": {
                  "type": "string"
                },
                "desktop": {
                  "type": "string"
                }
              }
            },
            "fontSize": {
              "type": "object",
              "properties": {
                "mobile": {
                  "type": "number"
                },
                "tablet": {
                  "type": "number"
                },
                "desktop": {
                  "type": "number"
                }
              }
            }
          }
        }
      }
    }
  }
}
